<!DOCTYPE suite SYSTEM "../tests/ajcTestSuite.dtd"[]>

<!-- AspectJ v1.5.2 Tests -->
<suite>

    <ajc-test dir="bugs152/pr145963" title="advice and deow">
      <compile files="ClassForAspectPath.java" aspectpath="adviceAndDeow.jar" options="-emacssym">
		<message kind="warning" line="9" text="There should be no printlns"/>
	  </compile>
    </ajc-test>

    <ajc-test dir="bugs152/pr145963" title="ensure advice label is correct">
      <compile files="C.java" aspectpath="adviceLabels.jar" options="-emacssym"/>
    </ajc-test>
    
    <ajc-test dir="bugs152/pr145963" title="aspect in default package">
      <compile files="C.java" aspectpath="aspectInDefaultPackage.jar" options="-emacssym"/>
    </ajc-test>

</suite>
